N;Savol;Javob1;Javob2;Javob3;Javob4;
50;Система, являющаяся промежуточным элементом национальной и мировой валютных систем и служащая для интеграции территориальной группы стран, называется...;Территориальная валютная система;Переферильная валютная система;Национальная валютная система;Мировая валютная система
51;В каком году был введен евро, валюта Европейского валютного союза?;в 1999 году;в 2000 году;в 2002 году;в 1989 году
52;Какие виды гарантий широко используются в экспортно-импортных операциях;Опосредованная гарантия;Подтвержденная гарантия;Правильные гарантии;Государственные гарантии
53;Обесценивание национальной валюты по отношению к иностранным валютам или международным расчетным единицам…;девальвация;ревальвация;Валютный арбитраж;Валютный диллинг
54;Валюта платежа -;валюта, в которой должны быть урегулированы обязательства импортера (или заемщика).;валюта, в которой выражается цена товара.;валюта развитых стран.;валюта, в которой должны быть урегулированы обязательства экспортера (или заемщика).
55;Операция по обмену валюты в течение двух рабочих дней, исключая день операции, считается…;опирация спот;опирация своп;опирация форвард;Срочные валютные операции
56;Какие бывают валютные позиции?;Октрытый и закрытый;Закрытые, длинные и короткие;Активные и пассивные;Долгосрочные и краткосрочные
57;Найдите ответ, в котором перечислены типы вариантов?;call-опцион, put-опцион;Привелигерованный опцион;Спред опцион;Опцион продаж
58;Что такое спред?;Разница в котировках покупателя — это рассчитанная разница между ценой продавца и ценой продавца.;Конверсия ;Прибыль ;Дивиденд
59;Как называются операции по торговле валютой в коммерческих банках и на биржах?;Валютный диллинг;Конверсия ;Инфляция ;Нулификация 
60;Мировая финансовая архитектура -;институциональная структура международной финансовой системы, определяющая функциональные отношения и образующая ее структурные элементы;это лишь понятие, представляющее финансовые отношения внутри народного хозяйства;это понятие, которое представляет собой внутренние финансовые отношения на предприятиях;понятие, представляющее финансовые отношения между коммерческими банками и населением
61;Что такое дефляционная политика?;Эта политика направлена ​​на сокращение внутреннего спроса, замораживание расходов бюджета, цен и заработной платы, направленных в первую очередь на граждан.;В платежном балансе это означает, что поступления превышают платежи.;Означает сумму мероприятий, направленных на покрытие дефицита платежного баланса.;В платежном балансе это означает, что платежи превышают поступления
62;Что отражается в текущем балансе счета?;Торговый баланс, баланс услуг, односторонние переводы;Торговый баланс, баланс услуг, односторонние трансферты, чистые иностранные инвестиции;Баланс услуг, односторонние переводы, чистые кредиты, полученные из-за границы;Баланс услуг, неодносторонние переводы, чистые кредиты, полученные из-за границы
63;Определить полный спектр инструментов валютной политики?;валютные интервенции, девальвация, переоценка и диверсификация валютных резервов;девальвация, переоценка, процентная ставка и диверсификация валютных резервов;валютная интервенция, девальвация и процентная ставка;процентная ставка, валютная интервенция, переоценка и диверсификация валютных резервов
64;Как сохранение реального обменного курса на высоком уровне влияет на экономический рост?;Замедлица ;Не повлияет;Ускорит ;Остановится 
65;Стимулирующая денежно-кредитная политика в условиях открытой экономики с плавающим обменным курсом:;приводит к уменьшению дохода;не приводит к уменьшению дохода;в зависимости от уровня мобильности капитала может привести к увеличению или снижению уровня доходов;может привести к снижению доходов независимо от уровня мобильности капитала
66;Что из следующего относится к конвертации валюты государством по любому рыночному курсу?;Система плавающего курса;Система ползучего курса;Система не плавающего курса;Система фиксированного курса
67;Кто разрабатывает платёжный баланс в Узбекистане?;Центральный Банк Рузб;Правительство Рузб;Министерство экономики и финансов;МВФ
68;Найдите ответ, соответствующий определению: Какова цена валютного курса, выраженная в единицах национальной валюты?;Валютный курс;Крузейро;Реал;Евродоллар
69;Валютная система – это форма организации валютных отношений, регулируемая:;Национальным законодательством ;Банковскими традициями и обычаями;Только Международным валютным фондом;нет верного ответа
70;Маркетмейкеры –;это финансовые организации, которые регулярно котируют курсы покупки и продажи различных валют и заключают по ним контракты.;финансовые организации, занимающиеся торговлей валютой;финансовые организации, устанавливающие процентные ставки по валютам;валютная инфляция
71;Что такое форвардный курс?;Быстрый обменный курс;Не быстрый обменный курс;Инфляционный курс;Кредитный курс
72;Известно, что снижение обменного курса приводит к увеличению цены импорта. Как это повлияет на национальную экономику?;увеличивает спрос на товары и услуги, производимые в национальной экономике;снижает спрос на товары и услуги, производимые в национальной экономике;будет стимулировать увеличение импорта;не оказывает существенного влияния
73;Каков платежный баланс?;Отношение фактических платежей страны в иностранной валюте к ее поступлениям из других стран;Соотношение требований и обязательств страны перед зарубежными странами;Только соотношение платежей и поступлений, связанных с международным кредитом, фактически произведенным;Соотношение между ценой золотовалютных резервов и ценой золотовалютных резервов
74;Найдите тип рынка, который является частью международного и национального финансового рынка, на котором кредитные и долговые операции осуществляются в евро?;рынок евро;рынок рублей;рынок юаня;рынок сума
75;Что представляет собой выпуск ценных бумаг на основании данного кредитного обеспечения?;секьюритизация кредита;несекьюритизация кредита;секьюритизация валюты;секьюритизация займа
76;Является ли в международной практике стандартным видом лизинга, когда компания, сдающая оборудование в лизинг, в дальнейшем выкупает его полностью по остаточной стоимости?;Финансовый лизинг;нефинансовый лизинг;Долговой лизинг;Форфейтинговый  лизинг
77;Показать наиболее невыгодный аспект аккредитива для импортера;Оплата производится заранее, возможности проверить качество товара мало;Нет недостатка;Документы бенефициара приходят с опозданием;Банк действует от собственного имени
78;Укажите недостаток, характерный для документированного аккредитива;Размер комиссии высок;Сложно контролировать качество товара;Оплата не гарантирована;Оплата гарантирована
79;Какой банк отвечает за своевременную оплату по документарному инкассо?;Ни один банк не несет ответственности;Один банк несет ответственности;Два банка не несут ответственности;Пять банков не несут ответственности
80;Количественные методы регулирования внешней торговли;технические барьеры, санитарные нормы, внутренние налоги, госзакупки местных товаров;тарифная квота, ввозная пошлина;субсидия, демпинг, кредитование;квота, лицензирование, КЭЧ
81;Что такое концессионные соглашения?;это договоры, заключенные на добычу и использование природных ресурсов и некоторых полезных ископаемых.;контракты, направленные на финансирование инвестиционных проектов;договоры на осуществление лизинговых операций;договоры купли-продажи валютных активов
82;Демпинг –;Это финансовый метод торговой политики, который заключается в экспорте товаров на внешний рынок по ценам ниже обычных цен, существующих в стране.;является производной формой любого финансового рычага.;Учетная ставка — процентная ставка по кредитам, выдаваемым Центральным банком коммерческим банкам путем пересчета находящихся в их распоряжении векселей.;относится к политике государственных органов по влиянию на курс национальной валюты путем продажи или покупки иностранной валюты.
83;Активный платежный баланс -;в платежном балансе сумма доходов превышает сумму платежей.;в платежном балансе сумма платежей превышает сумму поступлений.;в платежном балансе сумма поступлений равна сумме платежей.;сумма экспортной выручки не учитывается в торговом балансе.
84;Каковы принципы международного кредита?;возвратность, зрелость, платежеспособность, материальная обеспеченность, целеустремленность;зрелость, платежеспособность, материальная обеспеченность, целеустремленность;возвратность, своевременность, материальное обеспечение, целеустремленность;возвратность, срок погашения, платежеспособность, материальное обеспечение
85;Сколько функций выполняет международный кредит?;3;2;4;5
86;Пассивный платежный баланс -;сумма поступлений равна сумме платежей.;сумма импортной выручки не учитывается в торговом балансе;сумма выплат равна сумме поступлений.;Все ответы верны
87;Спекулянты –;участники, которые намерены получить прибыль от разницы курсов финансовых инструментов.;участники, которые намерены получить прибыль от разницы курсов финансовых инструментов.;операции, по которым валюта поступает в течение двух рабочих дней после заключения валютной сделки.;компании, основная компания которых принадлежит столице одной страны, а филиалы разбросаны по всему миру.
88;Когда Узбекистан стал членом Азиатского банка развития (АБР)?;1995 г.;1993 г.;1994 г.;1992 г.
89;Когда Узбекистан стал членом Европейского банка реконструкции и развития (ЕБРР)?;1992 г.;1993 г.;1994 г.;1991 г.
90;Внешнеэкономическая деятельность означает -;Под совокупными практическими усилиями государственных органов, юридических и физических лиц Республики Узбекистан, направленными на установление взаимовыгодного сотрудничества и развитие такого сотрудничества с зарубежными странами, их юридическими и физическими лицами и международными организациями.;экономическое, общественно-политическое и культурное объединение стран на основе развития устойчивых отношений между национальными хозяйствами и разделения труда.;процесс регулирования взаимных финансовых отношений национальных экономик;процесс введения ограничений на отношения между странами, связанные с движением товаров, услуг и капитала
91;Показать основной правовой документ, регулирующий внешнеэкономическую деятельность Республики Узбекистан;Закон «О внешнеэкономической деятельности».;Закон «О валютном регулировании».;Закон «Об иностранных инвестициях».;"Закон ""О тарифах""."
92;Когда Республика Узбекистан стала членом Международного валютного фонда?;1992 г. 21 сентября;1984 г. 21 ноября;1989 г. 21 октября;1999 г. 25 декабря
93;Квота - это государственное ограничение экспорта - импорта...;количеством и суммой;Пошлинами;антимонопольным регулированием;налогами
94;Наибольшая степень интернационализации характерна для -;товарного производства;Торговли;сферы услуг;финансовой сферы.
95;Для современной мировой практики характерна тенденция:;к удлинению сроков международных кредитов;сохранению сроков международных кредитов на сложившемся уровне;непредсказуемых колебаний сроков международных кредитов.;сокращению сроков международных кредитов
96;Признаком наступления кризиса внешней задолженности обычно служит …;нарушение графика погашения кредитов и займов;превышение объема импорта над экспортом;девальвация национальной валюты;количество взятых кредитов
97;Спекулятивные операции на мировом финансовом рынке:;увеличивают его ликвидность и ценовую стабильность;уменьшают его ликвидность и ценовую стабильность;увеличивают его ликвидность и уменьшают ценовую стабильность;уменьшают его ликвидность и увеличивают ценовую стабильность.
98;В условиях финансовой глобализации взаимозависимость стран мира:;Растет, изменяется непредсказуемым образом.;снижается;остается неизменной;нарастет
99;В условиях финансовой глобализации устойчивость финансовых рынков развивающихся стран:;увеличивается;остается неизменной;уменьшается;изменяется непредсказуемым образом.
100;Первым ввел в употребление термин “глобализация” …;Т.Левит;В.Жириновский;Ф.Энгельс;К.Маркс
101;Последствиями финансовой глобализации для мирового финансового рынка являются:;диверсификация обращающихся на рынке инструментов;повышение роли биржевого рынка;увеличение числа участников;рост затрат на обслуживание корпоративной задолженности
102;В условиях финансовой глобализации конкуренция на внутренних рынках финансовых услуг:;изменяется непредсказуемым образом.;увеличивается;уменьшается;остается неизменной
103;В условиях экономической глобализации доля финансовых инвестиций в общем объеме мировых инвестиций:;снижается;Остается неизменным;изменяется непредсказуемым образом.;растет
104;К последствиям глобализации относятся все перечисленные, кроме…;сокращения наукоемкого производства;углубления международного разделения труда и специализации под воздействием международной конкуренции;увеличения производства на предприятиях ТНК;ускорения внедрения новых технологий 
105;Показателем степени экономической глобализации является:;доля глобальных телекоммуникаций в общем объеме мировых телекоммуникаций;все перечисленное.;доля англоязычных материалов в общем объеме печатной продукции;доля международной торговли в мировом ВВП
106;В условиях современной финансовой глобализации наибольшими темпами растут обороты:;рынка производных финансовых инструментов.;кредитного рынка;рынка акций;рынка облигаций
107;В условиях экономической глобализации доля прямых иностранных инвестиций в общем объеме мировых инвестиций:;растет;снижается;изменяется непредсказуемым образом.;Остается неизменным
108;Валютный своп-это;комбинация двух противоположных конверсионных сделок на одинаковую сумму с разными датами валютирования;комбинация  более двух противоположных конверсионных сделок на одинаковую сумму с разными датами валютирования;комбинация двух противоположных конверсионных сделок на разную  сумму с одинаковыми  датами валютирования;комбинация двух противоположных конверсионных сделок на разную  сумму с разными датами валютирования
109;Датой валютирования применительно к споту называют;дата исполнения более близкой сделки;дата исполнения более удаленной по сроку обратной сделки;датой окончания свопа;датой начала  более удаленной по сроку обратной сделки
